<?xml version="1.0"?>
<input xmlns:xsi="http://www.w3.org/2001/XMLSchema-instance"
       xsi:noNamespaceSchemaLocation="../src/XML_Parser/input.xsd">

    <generalParams>
        <t_end>100</t_end>
        <delta_t>0.0005</delta_t>
        <writeFrequency>1000</writeFrequency>
        <dimensionType>3D</dimensionType>
        <parallelType>second</parallelType>

        <g_grav>-12.44</g_grav>
        <useGravity>yes</useGravity>
        <gravDirection>y</gravDirection>

        <calcType>LJ</calcType>
        <baseNameOutputFiles>RayleighTaylor_3D</baseNameOutputFiles>
        <cutoffRadius>3.6</cutoffRadius>
        <gravInput>../eingabe-sonne.txt</gravInput>

        <loadCheckpoint>no</loadCheckpoint>
        <makeCheckpoint>no</makeCheckpoint>
        <pathInCheckpoint>checkpoint_RT.txt</pathInCheckpoint>
        <pathOutCheckpoint>checkpoint_RT.txt</pathOutCheckpoint>

        <domainSizeX>60</domainSizeX>
        <domainSizeY>60</domainSizeY>
        <domainSizeZ>60</domainSizeZ>

        <useThermostat>yes</useThermostat>
        <thermostatType>regular</thermostatType>
        <useBrownianMotion>yes</useBrownianMotion>
        <T_init>40</T_init>
        <T_target>40</T_target>
        <delta_T>10000</delta_T>
        <n_thermostat>1000</n_thermostat>

        <useProfiling>no</useProfiling>
        <numberOfBins>50</numberOfBins>
        <pathToAnalysisFolder>../SimulationAnalysis_Files/RayleighTaylor/</pathToAnalysisFolder>

        <crystallization_r_c>0</crystallization_r_c>
        <crystallization_r_l>0</crystallization_r_l>
    </generalParams>

    <boundaryConditions>
        <top>betterReflectingType</top>
        <right>periodicType</right>
        <bottom>betterReflectingType</bottom>
        <left>periodicType</left>
        <front>periodicType</front>
        <back>periodicType</back>
    </boundaryConditions>

    <particlesLJ>
        <body>
            <bodyType>Cuboid</bodyType>
            <position>0.6,0.6,0.6</position>
            <velocity>0,0,0</velocity>
            <objectSpecificFormat>50,20,50</objectSpecificFormat>
            <epsilon>1.0</epsilon>
            <mass>1.0</mass>
            <rho>1.2</rho>
            <h>1.2</h>
            <bodyState>moving</bodyState>
        </body>

        <body>
            <bodyType>Cuboid</bodyType>
            <position>0.6,24.6,0.6</position>
            <velocity>0,0,0</velocity>
            <objectSpecificFormat>50,20,50</objectSpecificFormat>
            <epsilon>1.0</epsilon>
            <mass>2.0</mass>
            <rho>1.1</rho>
            <h>1.2</h>
            <bodyState>moving</bodyState>
        </body>
    </particlesLJ>
</input>