<?xml version="1.0"?>
<input xmlns:xsi="http://www.w3.org/2001/XMLSchema-instance"
       xsi:noNamespaceSchemaLocation="../src/XML_Parser/input.xsd">

    <generalParams>
        <t_end>250</t_end>
        <delta_t>0.001</delta_t>
        <writeFrequency>500</writeFrequency>
        <dimensionType>3D</dimensionType>
        <parallelType>first</parallelType>

        <g_grav>0</g_grav>
        <useGravity>no</useGravity>
        <gravDirection>y</gravDirection>

        <calcType>smoothedLJ</calcType>
        <baseNameOutputFiles>CoolingArgon</baseNameOutputFiles>
        <cutoffRadius>2.3</cutoffRadius>
        <gravInput>../eingabe-sonne.txt</gravInput>

        <loadCheckpoint>yes</loadCheckpoint>
        <makeCheckpoint>no</makeCheckpoint>
        <pathInCheckpoint>checkpoint_Crystal.txt</pathInCheckpoint>
        <pathOutCheckpoint>checkpoint_Crystal.txt</pathOutCheckpoint>

        <domainSizeX>9.2</domainSizeX>
        <domainSizeY>9.2</domainSizeY>
        <domainSizeZ>9.2</domainSizeZ>

        <useThermostat>yes</useThermostat>
        <thermostatType>regular</thermostatType>
        <useBrownianMotion>yes</useBrownianMotion>
        <T_init>3.0</T_init>
        <T_target>0.5</T_target>
        <delta_T>0.00078</delta_T>
        <n_thermostat>50</n_thermostat>

        <useProfiling>yes</useProfiling>
        <numberOfBins>50</numberOfBins>
        <pathToAnalysisFolder>../SimulationAnalysis_Files/Cooling</pathToAnalysisFolder>

        <crystallization_r_c>2.3</crystallization_r_c>
        <crystallization_r_l>1.9</crystallization_r_l>
    </generalParams>

    <boundaryConditions>
        <top>periodicType</top>
        <right>periodicType</right>
        <bottom>periodicType</bottom>
        <left>periodicType</left>
        <front>periodicType</front>
        <back>periodicType</back>
    </boundaryConditions>

    <particlesLJ>
    </particlesLJ>
</input>