<?xml version="1.0"?>
<input xmlns:xsi="http://www.w3.org/2001/XMLSchema-instance"
       xsi:noNamespaceSchemaLocation="../src/XML_Parser/input.xsd">

    <generalParams>
        <t_end>1000</t_end>
        <delta_t>0.014</delta_t>
        <writeFrequency>10</writeFrequency>
        <dimensionType>2D</dimensionType>
        <parallelType>notParallel</parallelType>

        <g_grav>0</g_grav>
        <useGravity>no</useGravity>
        <gravDirection>z</gravDirection>

        <calcType>G</calcType>
        <baseNameOutputFiles>Grav</baseNameOutputFiles>
        <cutoffRadius>0</cutoffRadius>
        <gravInput>../eingabe-sonne.txt</gravInput>

        <loadCheckpoint>no</loadCheckpoint>
        <makeCheckpoint>no</makeCheckpoint>
        <pathInCheckpoint></pathInCheckpoint>
        <pathOutCheckpoint></pathOutCheckpoint>

        <domainSizeX>0</domainSizeX>
        <domainSizeY>0</domainSizeY>
        <domainSizeZ>0</domainSizeZ>

        <useThermostat>no</useThermostat>
        <thermostatType>regular</thermostatType>
        <useBrownianMotion>no</useBrownianMotion>
        <T_init>0</T_init>
        <T_target>0</T_target>
        <delta_T>0</delta_T>
        <n_thermostat>0</n_thermostat>

        <useProfiling>no</useProfiling>
        <numberOfBins>1</numberOfBins>
        <pathToAnalysisFolder>../SimulationAnalysis_Files</pathToAnalysisFolder>

        <crystallization_r_c>0</crystallization_r_c>
        <crystallization_r_l>0</crystallization_r_l>
    </generalParams>

    <boundaryConditions>
        <top>outflowType</top>
        <right>outflowType</right>
        <bottom>outflowType</bottom>
        <left>outflowType</left>
        <front>outflowType</front>
        <back>outflowType</back>
    </boundaryConditions>

    <particlesLJ>
    </particlesLJ>

</input>