<?xml version="1.0"?>
<input xmlns:xsi="http://www.w3.org/2001/XMLSchema-instance"
       xsi:noNamespaceSchemaLocation="../XML_Parser/input.xsd">

    <generalParams>
        <t_end>0.5</t_end>
        <delta_t>0.0005</delta_t>
        <writeFrequency>100000</writeFrequency>
        <dimensionType>2D</dimensionType>

        <g_grav>-12.44</g_grav>
        <useGravity>yes</useGravity>

        <calcType>LJ</calcType>
        <baseNameOutputFiles>RayleighTaylor_large</baseNameOutputFiles>
        <particleContainerType>linkedCell</particleContainerType>
        <cutoffRadius>3.0</cutoffRadius>
        <gravInput>../eingabe-sonne.txt</gravInput>

        <loadCheckpoint>no</loadCheckpoint>
        <makeCheckpoint>no</makeCheckpoint>
        <pathInCheckpoint>checkpoint_FallingDropLiquid_fluid.txt</pathInCheckpoint>
        <pathOutCheckpoint>checkpoint_FallingDropLiquid_fluid.txt</pathOutCheckpoint>

        <domainSizeX>300</domainSizeX>
        <domainSizeY>54</domainSizeY>
        <domainSizeZ>0</domainSizeZ>

        <useThermostat>yes</useThermostat>
        <useBrownianMotion>yes</useBrownianMotion>
        <T_init>40</T_init>
        <T_target>40</T_target>
        <delta_T>-1</delta_T>
        <n_thermostat>1000</n_thermostat>
    </generalParams>

    <boundaryConditions>
        <top>outflowType</top>
        <right>outflowType</right>
        <bottom>outflowType</bottom>
        <left>outflowType</left>
        <front>outflowType</front>
        <back>outflowType</back>
    </boundaryConditions>

    <particlesLJ>
        <body>
            <bodyType>Cuboid</bodyType>
            <position>0.6,2,0</position>
            <velocity>0,0,0</velocity>
            <objectSpecificFormat>250,20,1</objectSpecificFormat>
            <epsilon>1.0</epsilon>
            <mass>1.0</mass>
            <rho>1.2</rho>
            <h>1.2</h>
        </body>

        <body>
            <bodyType>Cuboid</bodyType>
            <position>0.6,27,0</position>
            <velocity>0,0,0</velocity>
            <objectSpecificFormat>250,20,1</objectSpecificFormat>
            <epsilon>1.0</epsilon>
            <mass>2.0</mass>
            <rho>1.1</rho>
            <h>1.2</h>
        </body>
    </particlesLJ>

</input>