<?xml version="1.0"?>
<input xmlns:xsi="http://www.w3.org/2001/XMLSchema-instance"
       xsi:noNamespaceSchemaLocation="../src/XML_Parser/input.xsd">

    <generalParams>
        <t_end>500</t_end>
        <delta_t>0.0005</delta_t>
        <writeFrequency>1000</writeFrequency>
        <dimensionType>3D</dimensionType>
        <parallelType>first</parallelType>

        <g_grav>-0.8</g_grav>
        <useGravity>yes</useGravity>
        <gravDirection>y</gravDirection>

        <calcType>LJ</calcType>
        <baseNameOutputFiles>Spheres</baseNameOutputFiles>
        <cutoffRadius>2.75</cutoffRadius>
        <gravInput>../eingabe-sonne.txt</gravInput>

        <loadCheckpoint>no</loadCheckpoint>
        <makeCheckpoint>no</makeCheckpoint>
        <pathInCheckpoint>checkpoint_RT.txt</pathInCheckpoint>
        <pathOutCheckpoint>checkpoint_RT.txt</pathOutCheckpoint>

        <domainSizeX>30</domainSizeX>
        <domainSizeY>30</domainSizeY>
        <domainSizeZ>12</domainSizeZ>

        <useThermostat>yes</useThermostat>
        <thermostatType>onlyFluid</thermostatType>
        <useBrownianMotion>yes</useBrownianMotion>
        <T_init>40</T_init>
        <T_target>40</T_target>
        <delta_T>10000</delta_T>
        <n_thermostat>10</n_thermostat>

        <useProfiling>yes</useProfiling>
        <numberOfBins>50</numberOfBins>
        <pathToAnalysisFolder>../Analysis_Files/Spheres</pathToAnalysisFolder>

        <crystallization_r_c>0</crystallization_r_c>
        <crystallization_r_l>0</crystallization_r_l>
    </generalParams>

    <boundaryConditions>
        <top>periodicType</top>
        <right>outflowType</right>
        <bottom>periodicType</bottom>
        <left>outflowType</left>
        <front>periodicType</front>
        <back>periodicType</back>
    </boundaryConditions>

    <particlesLJ>
        <body>
            <bodyType>Cuboid</bodyType>
            <position>1.0,0.5,0.5</position>
            <velocity>0,0,0</velocity>
            <objectSpecificFormat>2,30,12</objectSpecificFormat>
            <epsilon>2.0</epsilon>
            <mass>1.0</mass>
            <rho>1.1</rho>
            <h>1.0</h>
            <bodyState>fixed</bodyState>
        </body>

        <body>
            <bodyType>Cuboid</bodyType>
            <position>27.2,0.5,0.5</position>
            <velocity>0,0,0</velocity>
            <objectSpecificFormat>2,30,12</objectSpecificFormat>
            <epsilon>2.0</epsilon>
            <mass>1.0</mass>
            <rho>1.1</rho>
            <h>1.0</h>
            <bodyState>fixed</bodyState>
        </body>

        <body>
            <bodyType>Cuboid</bodyType>
            <position>3.2,0.6,0.6</position>
            <velocity>0,0,0</velocity>
            <objectSpecificFormat>20,15,10</objectSpecificFormat>
            <epsilon>1.0</epsilon>
            <mass>1.0</mass>
            <rho>1.0</rho>
            <h>1.2</h>
            <bodyState>moving</bodyState>
        </body>

        <body>
            <bodyType>Sphere</bodyType>
            <position>10,24,6</position>
            <velocity>0,0,0</velocity>
            <objectSpecificFormat>3</objectSpecificFormat>
            <epsilon>1.0</epsilon>
            <mass>1.0</mass>
            <rho>1.0</rho>
            <h>1.2</h>
            <bodyState>fixed</bodyState>
        </body>

        <body>
            <bodyType>Sphere</bodyType>
            <position>20,24,6</position>
            <velocity>0,0,0</velocity>
            <objectSpecificFormat>3</objectSpecificFormat>
            <epsilon>1.0</epsilon>
            <mass>1.0</mass>
            <rho>1.0</rho>
            <h>1.2</h>
            <bodyState>fixed</bodyState>
        </body>
    </particlesLJ>
</input>