<?xml version="1.0"?>
<input xmlns:xsi="http://www.w3.org/2001/XMLSchema-instance"
       xsi:noNamespaceSchemaLocation="../XML_Parser/input.xsd">

    <generalParams>
        <t_end>15</t_end>
        <delta_t>0.0005</delta_t>
        <writeFrequency>100</writeFrequency>
        <dimensionType>3D</dimensionType>

        <g_grav>-12.44</g_grav>
        <useGravity>yes</useGravity>

        <calcType>LJ</calcType>
        <baseNameOutputFiles>Lennard</baseNameOutputFiles>
        <particleContainerType_p>linkedCell</particleContainerType_p>
        <cutoffRadius>3</cutoffRadius>
        <gravInput>../eingabe-sonne.txt</gravInput>

        <loadCheckpoint>no</loadCheckpoint>
        <makeCheckpoint>yes</makeCheckpoint>
        <pathInCheckpoint>Checkpoint_Files/checkpoint_FallingDropLiquid_fluid.txt</pathInCheckpoint>
        <pathOutCheckpoint>Checkpoint_Files/checkpoint_FallingDropLiquid_fluid.txt</pathOutCheckpoint>

        <domainSizeX>20</domainSizeX>
        <domainSizeY>20</domainSizeY>
        <domainSizeZ>6</domainSizeZ>

        <useThermostat>yes</useThermostat>
        <T_init>40</T_init>
        <T_target>40</T_target>
        <delta_T>2</delta_T>
        <n_thermostat>1000</n_thermostat>
    </generalParams>

    <boundaryConditions>
        <top>periodicType</top>
        <right>periodicType</right>
        <bottom>periodicType</bottom>
        <left>periodicType</left>
        <front>periodicType</front>
        <back>periodicType</back>
    </boundaryConditions>

    <particlesLJ>
        <body>
            <bodyType>Cuboid</bodyType>
            <position>1,1,1</position>
            <velocity>0,0,0</velocity>
            <objectSpecificFormat>10,10,1</objectSpecificFormat>
            <epsilon>5.0</epsilon>
            <mass>1.0</mass>
            <rho>1.2</rho>
            <h>1.2</h>
        </body>
    </particlesLJ>

</input>