<?xml version="1.0"?>
<input xmlns:xsi="http://www.w3.org/2001/XMLSchema-instance"
       xsi:noNamespaceSchemaLocation="../src/XML_Parser/input.xsd">

    <generalParams>
        <t_end>40</t_end>
        <delta_t>0.0005</delta_t>
        <writeFrequency>100</writeFrequency>
        <dimensionType>2D</dimensionType>
        <parallelType>notParallel</parallelType>

        <g_grav>-12.44</g_grav>
        <useGravity>yes</useGravity>
        <gravDirection>y</gravDirection>

        <calcType>LJ</calcType>
        <baseNameOutputFiles>FallingDrop</baseNameOutputFiles>
        <cutoffRadius>3</cutoffRadius>
        <gravInput>../eingabe-sonne.txt</gravInput>

        <loadCheckpoint>yes</loadCheckpoint>
        <makeCheckpoint>no</makeCheckpoint>
        <pathInCheckpoint>checkpoint_FallingDropLiquid_fluid.txt</pathInCheckpoint>
        <pathOutCheckpoint>checkpoint_FallingDropLiquid_fluid.txt</pathOutCheckpoint>

        <domainSizeX>303</domainSizeX>
        <domainSizeY>180</domainSizeY>
        <domainSizeZ>0</domainSizeZ>

        <useThermostat>no</useThermostat>
        <thermostatType>regular</thermostatType>
        <useBrownianMotion>no</useBrownianMotion>
        <T_init>40</T_init>
        <T_target>40</T_target>
        <delta_T>2</delta_T>
        <n_thermostat>1000</n_thermostat>

        <useProfiling>no</useProfiling>
        <numberOfBins>1</numberOfBins>
        <pathToAnalysisFolder>../SimulationAnalysis_Files</pathToAnalysisFolder>

        <crystallization_r_c>0</crystallization_r_c>
        <crystallization_r_l>0</crystallization_r_l>
    </generalParams>

    <boundaryConditions>
        <top>betterReflectingType</top>
        <right>betterReflectingType</right>
        <bottom>betterReflectingType</bottom>
        <left>betterReflectingType</left>
        <front>betterReflectingType</front>
        <back>betterReflectingType</back>
    </boundaryConditions>

    <particlesLJ>
        <body>
            <bodyType>Sphere</bodyType>
            <position>150,150,0</position>
            <velocity>0,0,0</velocity>
            <objectSpecificFormat>20</objectSpecificFormat>
            <epsilon>1.0</epsilon>
            <mass>1.0</mass>
            <rho>1.2</rho>
            <h>1.2</h>
            <bodyState>moving</bodyState>
        </body>
    </particlesLJ>
</input>