<?xml version="1.0"?>
<input xmlns:xsi="http://www.w3.org/2001/XMLSchema-instance"
       xsi:noNamespaceSchemaLocation="../src/XML_Parser/input.xsd">

    <generalParams>
        <t_end>1000</t_end>
        <delta_t>0.01</delta_t>
        <writeFrequency>200</writeFrequency>
        <dimensionType>3D</dimensionType>
        <parallelType>first</parallelType>

        <g_grav>-0.001</g_grav>
        <useGravity>yes</useGravity>
        <gravDirection>z</gravDirection>

        <calcType>LJ</calcType>
        <baseNameOutputFiles>Membrane</baseNameOutputFiles>
        <cutoffRadius>4</cutoffRadius>
        <gravInput>../eingabe-sonne.txt</gravInput>

        <loadCheckpoint>no</loadCheckpoint>
        <makeCheckpoint>no</makeCheckpoint>
        <pathInCheckpoint>checkpoint_RT.txt</pathInCheckpoint>
        <pathOutCheckpoint>checkpoint_RT.txt</pathOutCheckpoint>

        <domainSizeX>148</domainSizeX>
        <domainSizeY>148</domainSizeY>
        <domainSizeZ>148</domainSizeZ>

        <useThermostat>no</useThermostat>
        <thermostatType>onlyFluid</thermostatType>
        <useBrownianMotion>no</useBrownianMotion>
        <T_init>40</T_init>
        <T_target>40</T_target>
        <delta_T>10000</delta_T>
        <n_thermostat>10</n_thermostat>

        <useProfiling>no</useProfiling>
        <numberOfBins>1</numberOfBins>
        <pathToAnalysisFolder>../SimulationAnalysis_Files</pathToAnalysisFolder>

        <crystallization_r_c>0</crystallization_r_c>
        <crystallization_r_l>0</crystallization_r_l>
    </generalParams>

    <boundaryConditions>
        <top>betterReflectingType</top>
        <right>betterReflectingType</right>
        <bottom>betterReflectingType</bottom>
        <left>betterReflectingType</left>
        <front>betterReflectingType</front>
        <back>betterReflectingType</back>
    </boundaryConditions>

    <particlesLJ>
        <body>
            <bodyType>Membrane</bodyType>
            <position>15,15,1.5</position>
            <velocity>0,0,0</velocity>
            <objectSpecificFormat>n_50,50,1 r_2.2 k_300 f_0.8 p_(17,24),(17,25),(18,24),(18,25) t_150</objectSpecificFormat>
            <epsilon>1.0</epsilon>
            <mass>1.0</mass>
            <rho>1.0</rho>
            <h>2.2</h>
            <bodyState>moving</bodyState>
        </body>
    </particlesLJ>
</input>